{"schema":"sipi.run-request.v1","run_id":"run-1","project_id":"project-1","analysis_id":"analysis-1","attempt_id":"attempt-1","operation":"link.simulate.v1","payload_schema":"pybert.simulation.v1","payload":{"source":"fixture"},"backend_selection":{"mode":"strict","instance":"pybert-python"},"resource_limits":{"enforcement":"monitor","wall_time_s":null,"cpu_time_s":null,"memory_bytes":null,"process_count":null,"artifact_bytes":null},"randomness":{},"artifact_policy":{},"extensions":{}}
